{
  "$schema": "https://json-schema.org/draft/2020-12/schema",
  "$id": "https://github.com/dgcrensh/CharacterStudio/Schema/character-0.2.schema.json",
  "title": "Character Studio character",
  "description": "character.json inside a .charstudio package, format 0.2 (0.1 files are valid too). Units are points with the y-axis down, angles are degrees (clockwise on screen), and colors are sRGB hex with alpha. Readers should ignore keys they do not know.",
  "type": "object",
  "required": ["formatVersion"],
  "properties": {
    "formatVersion": {
      "description": "Semantic version of the format. Readers refuse a newer major version (in 0.x, a newer minor version).",
      "type": "string",
      "pattern": "^0\\.[12]\\.[0-9]+$"
    },
    "name": { "description": "The character's display name.", "type": "string" },
    "bones": {
      "description": "The bone tree, parents before children, starting with the root bone (parent null). Bone ids are unique and are the names shown in the editor.",
      "type": "array",
      "items": { "$ref": "#/$defs/bone" }
    },
    "slots": {
      "description": "Places on bones that show one attachment at a time.",
      "type": "array",
      "items": { "$ref": "#/$defs/slot" }
    },
    "drawOrder": {
      "description": "Slot ids from back to front. Slots missing from this list draw in front, in slot order.",
      "type": "array",
      "items": { "type": "string" },
      "uniqueItems": true
    },
    "skins": {
      "description": "Skin name to slot id to attachment name to attachment. \"default\" comes first; other skins (outfits) hold only the slots they refill. Several attachments in one slot are the part's variants.",
      "type": "object",
      "additionalProperties": {
        "type": "object",
        "additionalProperties": {
          "type": "object",
          "additionalProperties": { "$ref": "#/$defs/attachment" }
        }
      }
    },
    "poses": {
      "description": "Saved test poses: pose name to bone id to a transform relative to the rest pose (the app writes rotation only, in degrees, applied after the parent's pose). Bones not named stay at rest. Empty in 0.1.",
      "type": "object",
      "additionalProperties": {
        "type": "object",
        "additionalProperties": {
          "type": "object",
          "properties": {
            "x": { "type": "number" },
            "y": { "type": "number" },
            "rotation": { "type": "number" },
            "scaleX": { "type": "number" },
            "scaleY": { "type": "number" }
          }
        }
      }
    },
    "animations": { "description": "Reserved for the animation system. Empty in 0.1.", "type": "object" },
    "palette": {
      "description": "The character's reusable colors: plain colors, then named global colors that shapes can follow (format 0.2).",
      "type": "array",
      "items": {
        "oneOf": [
          { "$ref": "#/$defs/color" },
          {
            "description": "A global color. Shapes refer to it by name; names are unique.",
            "type": "object",
            "required": ["name", "color"],
            "properties": {
              "name": { "type": "string" },
              "color": { "$ref": "#/$defs/color" }
            }
          }
        ]
      }
    },
    "references": {
      "description": "Editor-only reference images, bottom to top. Not part of the character: animation tools should ignore them.",
      "type": "array",
      "items": { "$ref": "#/$defs/reference" }
    },
    "frame": {
      "description": "Optional editor hint: the target box the character is drawn for (top-left x, y and size, in world space) and the y of the ground line it stands on. Also the area the editor exports. Written only when set.",
      "type": "object",
      "required": ["x", "y", "width", "height"],
      "properties": {
        "x": { "type": "number" },
        "y": { "type": "number" },
        "width": { "type": "number", "exclusiveMinimum": 0 },
        "height": { "type": "number", "exclusiveMinimum": 0 },
        "ground": { "description": "Defaults to the bottom of the box.", "type": "number" },
        "hidden": { "description": "Written only when true: the editor doesn't show the frame.", "type": "boolean" }
      }
    }
  },
  "$defs": {
    "vec2": {
      "type": "array",
      "items": { "type": "number" },
      "minItems": 2,
      "maxItems": 2
    },
    "color": {
      "description": "#RRGGBBAA (or #RRGGBB, opaque), straight alpha.",
      "type": "string",
      "pattern": "^#([0-9A-Fa-f]{6}|[0-9A-Fa-f]{8})$"
    },
    "bone": {
      "type": "object",
      "required": ["id", "parent"],
      "properties": {
        "id": { "type": "string" },
        "parent": { "description": "Parent bone id, or null for the root.", "type": ["string", "null"] },
        "length": { "type": "number", "minimum": 0 },
        "x": { "description": "Rest position of the bone's head in the parent bone's space.", "type": "number" },
        "y": { "type": "number" },
        "rotation": { "description": "Rest rotation relative to the parent bone, in degrees clockwise. The bone points along its own +x axis.", "type": "number" },
        "scaleX": { "type": "number" },
        "scaleY": { "type": "number" }
      }
    },
    "slot": {
      "type": "object",
      "required": ["id", "bone"],
      "properties": {
        "id": { "type": "string" },
        "bone": { "type": "string" },
        "attachment": { "description": "The attachment shown by default (the shown variant, for a part with several), or absent for an empty slot.", "type": "string" },
        "accessoryOf": { "description": "The id of the slot this one is an accessory of (hair or a hat on the head). Written only for accessories. An accessory is on its owner's bone and has its own place in drawOrder.", "type": "string" },
        "behindSlot": { "description": "For an accessory with behindOwner shapes: the id of the slot those shapes draw just behind instead of the owner (the neck, for long back hair on the head). Written only when it isn't the owner. An unknown slot reads as the owner.", "type": "string" }
      }
    },
    "attachment": {
      "type": "object",
      "required": ["type", "shapes"],
      "properties": {
        "type": { "const": "vector" },
        "pivot": { "description": "The part's own pivot, independent of the bone origin.", "$ref": "#/$defs/vec2" },
        "hidden": { "description": "Editor hint: the part is hidden while editing. Defaults to false. Animation tools draw it as usual.", "type": "boolean" },
        "locked": { "description": "Editor hint: the part can't be selected or changed while editing. Defaults to false.", "type": "boolean" },
        "groups": {
          "description": "Groups of this attachment's shapes, bottom to top. Written only when there are some. Groups don't nest and don't change how shapes draw, except that clipping stays within a group and a clipped group draws inside the shape below it.",
          "type": "array",
          "items": {
            "type": "object",
            "required": ["id"],
            "properties": {
              "id": { "description": "Local to the attachment.", "type": "integer" },
              "name": { "type": "string" },
              "clipped": { "description": "The whole group draws only where the nearest shape below it that isn't clipped (or in a clipped group) draws, like a clipped shape. Clipped shapes inside the group still clip within it. Defaults to false.", "type": "boolean" }
            }
          }
        },
        "shapes": {
          "description": "Back to front.",
          "type": "array",
          "items": { "$ref": "#/$defs/shape" }
        }
      }
    },
    "shape": {
      "type": "object",
      "required": ["closed", "points"],
      "properties": {
        "closed": { "type": "boolean" },
        "group": { "description": "The id of the attachment's group this shape belongs to. A group's shapes are next to each other in shapes.", "type": "integer" },
        "fill": { "description": "Solid fill, closed paths only (non-zero winding). Absent means no fill. With a gradient, the color to show where gradients are not supported.", "$ref": "#/$defs/color" },
        "fillGlobal": { "description": "Format 0.2: the name of the global color (in palette) the fill follows. fill holds its current value.", "type": "string" },
        "gradient": { "description": "Format 0.2: draws the fill as a gradient. Only with a fill.", "$ref": "#/$defs/gradient" },
        "stroke": {
          "description": "Outline. Absent means no outline. Format 0.1 outlines are uniform with round caps and joins; the keys after width are format 0.2 and optional.",
          "type": "object",
          "required": ["color", "width"],
          "properties": {
            "color": { "$ref": "#/$defs/color" },
            "global": { "description": "The name of the global color (in palette) the outline follows. color holds its current value.", "type": "string" },
            "width": { "description": "Width in points; each point's w multiplies it.", "type": "number", "minimum": 0 },
            "cap": { "description": "Ends of open paths and dashes. Defaults to round.", "enum": ["butt", "round", "square"] },
            "join": { "description": "Corners. Defaults to round.", "enum": ["miter", "round", "bevel"] },
            "miterLimit": { "description": "A miter longer than this many half-widths becomes a bevel. Defaults to 4.", "type": "number", "minimum": 1 },
            "dash": { "description": "Dash and gap lengths in points, alternating from a dash; an odd list repeats twice. Absent means solid.", "type": "array", "items": { "type": "number", "minimum": 0 } },
            "dashOffset": { "description": "How far into the dash pattern the path starts. Defaults to 0.", "type": "number" },
            "align": { "description": "For closed paths: the outline centered on the path, inside the fill area or outside it. Open paths always center. Defaults to center.", "enum": ["center", "inside", "outside"] }
          }
        },
        "opacity": { "description": "Format 0.2: multiplies the alpha of the fill and of the outline (each on its own). Defaults to 1.", "type": "number", "minimum": 0, "maximum": 1 },
        "clipped": { "description": "Format 0.2: the shape draws only where the nearest unclipped shape below it in the same attachment (and the same group, when it has one) draws (its fill and outline). Defaults to false.", "type": "boolean" },
        "behindOwner": { "description": "In an accessory's attachment: the shape draws just behind its owner's attachment instead of with the rest of the accessory, in its order among the accessory's other behind shapes. Ignored in a part that isn't an accessory. Defaults to false.", "type": "boolean" },
        "hidden": { "description": "Editor hint: the shape is hidden while editing. Defaults to false. Animation tools draw it as usual.", "type": "boolean" },
        "locked": { "description": "Editor hint: the shape can't be selected or changed while editing. Defaults to false.", "type": "boolean" },
        "points": {
          "description": "Cubic Bézier anchors. Segment i runs from point i (p + out) to point i+1 (p + in); closed paths also join the last point to the first.",
          "type": "array",
          "items": { "$ref": "#/$defs/point" }
        }
      }
    },
    "point": {
      "type": "object",
      "required": ["p"],
      "properties": {
        "p": { "description": "Anchor position.", "$ref": "#/$defs/vec2" },
        "in": { "description": "Incoming handle, as an offset from p. Defaults to [0, 0].", "$ref": "#/$defs/vec2" },
        "out": { "description": "Outgoing handle, as an offset from p. Defaults to [0, 0].", "$ref": "#/$defs/vec2" },
        "w": { "description": "Format 0.2: the outline width here as a multiple of the stroke width, blended linearly along each segment. Defaults to 1.", "type": "number", "minimum": 0 },
        "smooth": { "description": "Editor hint: false for a corner point. Defaults to true.", "type": "boolean" },
        "symmetric": { "description": "Editor hint: true when the handles are kept equally long and opposite. Defaults to false; ignored on corner points.", "type": "boolean" },
        "stroked": { "description": "Format 0.2: false leaves the segment from this point to the next without an outline; the fill still covers it. Defaults to true; ignored on the last point of an open path.", "type": "boolean" },
        "weights": {
          "description": "[bone id, weight] pairs for blended binding: the point moves by the blend of the bones' pose transforms, weighted by their shares. The app writes the slot's bone and one second bone on every point of a part that bends. Rigid parts omit this and follow their slot's bone.",
          "type": "array",
          "items": {
            "type": "array",
            "prefixItems": [{ "type": "string" }, { "type": "number", "minimum": 0, "maximum": 1 }],
            "minItems": 2,
            "maxItems": 2
          }
        }
      }
    },
    "gradient": {
      "description": "Points are in the attachment's space, so the gradient moves with the shape.",
      "type": "object",
      "required": ["type", "start", "end", "stops"],
      "properties": {
        "type": { "description": "linear runs from start to end; radial runs from start (the center) out to the circle through end.", "enum": ["linear", "radial"] },
        "start": { "$ref": "#/$defs/vec2" },
        "end": { "$ref": "#/$defs/vec2" },
        "stops": {
          "description": "Colors by offset, 0 at start and 1 at end, interpolated in straight alpha.",
          "type": "array",
          "minItems": 1,
          "items": {
            "type": "object",
            "required": ["offset", "color"],
            "properties": {
              "offset": { "type": "number", "minimum": 0, "maximum": 1 },
              "color": { "$ref": "#/$defs/color" }
            }
          }
        }
      }
    },
    "reference": {
      "type": "object",
      "required": ["file", "width", "height"],
      "properties": {
        "name": { "type": "string" },
        "file": { "description": "Image file path inside the package, under references/.", "type": "string" },
        "width": { "description": "Natural image size in points, before scale.", "type": "number", "exclusiveMinimum": 0 },
        "height": { "type": "number", "exclusiveMinimum": 0 },
        "x": { "description": "Center in world space.", "type": "number" },
        "y": { "type": "number" },
        "rotation": { "type": "number" },
        "scale": { "type": "number", "exclusiveMinimum": 0 },
        "opacity": { "type": "number", "minimum": 0, "maximum": 1 },
        "hidden": { "type": "boolean" }
      }
    }
  }
}
