{
  "formatVersion": "0.2.0",
  "name": "Robo",
  "bones": [
    { "id": "root", "parent": null, "length": 0, "x": 0, "y": 0, "rotation": 0, "scaleX": 1, "scaleY": 1 },
    { "id": "Spine", "parent": "root", "length": 80, "x": 0, "y": -10, "rotation": -90, "scaleX": 1, "scaleY": 1 },
    { "id": "Neck", "parent": "Spine", "length": 20, "x": 80, "y": 0, "rotation": 0, "scaleX": 1, "scaleY": 1 },
    { "id": "Arm.L", "parent": "Spine", "length": 40, "x": 70, "y": 36, "rotation": 90, "scaleX": 1, "scaleY": 1 },
    { "id": "Arm.R", "parent": "Spine", "length": 40, "x": 70, "y": -36, "rotation": -90, "scaleX": 1, "scaleY": 1 }
  ],
  "slots": [
    { "id": "Torso", "bone": "root", "attachment": "Torso" },
    { "id": "Head", "bone": "Neck", "attachment": "Head" }
  ],
  "drawOrder": ["Torso", "Head"],
  "skins": {
    "default": {
      "Torso": {
        "Torso": {
          "type": "vector",
          "pivot": [0, -40],
          "shapes": [
            {
              "closed": true,
              "fill": "#5A8DEEFF",
              "fillGlobal": "Body",
              "gradient": {
                "type": "linear",
                "start": [0, -90],
                "end": [0, 8],
                "stops": [
                  { "offset": 0, "color": "#5A8DEEFF" },
                  { "offset": 1, "color": "#3655A0FF" }
                ]
              },
              "stroke": { "color": "#222222FF", "global": "Ink", "width": 3, "join": "miter" },
              "points": [
                { "p": [-30, -90], "in": [0, 0], "out": [0, 0], "smooth": false, "stroked": false },
                { "p": [30, -90], "in": [0, 0], "out": [0, 0], "smooth": false },
                { "p": [36, -10], "in": [0, -20], "out": [-8, 14] },
                { "p": [0, 8], "in": [18, 0], "out": [-18, 0] },
                { "p": [-36, -10], "in": [8, 14], "out": [0, -20] }
              ]
            },
            {
              "closed": true,
              "fill": "#1A2A5040",
              "clipped": true,
              "points": [
                { "p": [20, -60], "in": [0, -22], "out": [0, 22] },
                { "p": [44, -20], "in": [-14, 0], "out": [14, 0] },
                { "p": [64, -60], "in": [0, 22], "out": [0, -22] },
                { "p": [44, -100], "in": [14, 0], "out": [-14, 0] }
              ]
            },
            {
              "closed": true,
              "fill": "#FFFFFF80",
              "opacity": 0.8,
              "points": [
                { "p": [-12, -70], "in": [0, -6.5], "out": [0, 6.5] },
                { "p": [0, -58], "in": [-6.5, 0], "out": [6.5, 0] },
                { "p": [12, -70], "in": [0, 6.5], "out": [0, -6.5] },
                { "p": [0, -82], "in": [6.5, 0], "out": [-6.5, 0] }
              ]
            },
            {
              "closed": false,
              "stroke": { "color": "#222222FF", "global": "Ink", "width": 1.5, "cap": "butt", "dash": [4, 3] },
              "points": [
                { "p": [-30, -30], "in": [0, 0], "out": [0, 0], "smooth": false },
                { "p": [30, -30], "in": [0, 0], "out": [0, 0], "smooth": false }
              ]
            }
          ]
        }
      },
      "Head": {
        "Head": {
          "type": "vector",
          "pivot": [20, 0],
          "shapes": [
            {
              "closed": true,
              "fill": "#F2A65AFF",
              "fillGlobal": "Skin",
              "stroke": { "color": "#222222FF", "global": "Ink", "width": 3, "align": "inside" },
              "points": [
                { "p": [60, 0], "in": [0, -22.0914], "out": [0, 22.0914] },
                { "p": [20, 40], "in": [22.0914, 0], "out": [-22.0914, 0] },
                { "p": [-20, 0], "in": [0, 22.0914], "out": [0, -22.0914] },
                { "p": [20, -40], "in": [-22.0914, 0], "out": [22.0914, 0] }
              ]
            },
            {
              "closed": false,
              "stroke": { "color": "#222222FF", "global": "Ink", "width": 2.5 },
              "points": [
                { "p": [6, -14], "in": [0, 0], "out": [-5, 4], "w": 0.3 },
                { "p": [-1, 0], "in": [0, -8], "out": [0, 8], "w": 1.4 },
                { "p": [6, 14], "in": [-5, -4], "out": [0, 0], "w": 0.3 }
              ]
            }
          ]
        }
      }
    }
  },
  "poses": {},
  "animations": {},
  "palette": [
    "#FFFFFF80",
    { "name": "Skin", "color": "#F2A65AFF" },
    { "name": "Body", "color": "#5A8DEEFF" },
    { "name": "Ink", "color": "#222222FF" }
  ],
  "references": [
    {
      "name": "Sketch",
      "file": "references/reference-1.png",
      "width": 4,
      "height": 4,
      "x": 0,
      "y": -80,
      "rotation": 90,
      "scale": 40,
      "opacity": 0.35,
      "hidden": false
    }
  ],
  "frame": { "x": -90, "y": -170, "width": 180, "height": 190, "ground": 8 }
}
